{
  "$schema": "http://json-schema.org/draft-07/schema#",
  "$id": "task-spec.schema.json",
  "type": "object",
  "additionalProperties": false,
  "required": ["title", "role_required", "objective", "acceptance_criteria", "allowed_paths", "required_tests", "risk_level"],
  "properties": {
    "title": { "type": "string", "minLength": 1 },
    "role_required": { "$ref": "agent-role.schema.json" },
    "objective": { "type": "string", "minLength": 1 },
    "acceptance_criteria": {
      "type": "array",
      "minItems": 1,
      "items": { "type": "string", "minLength": 1 }
    },
    "allowed_paths": {
      "type": "array",
      "minItems": 1,
      "items": { "type": "string", "minLength": 1 }
    },
    "required_tests": {
      "type": "array",
      "items": { "type": "string", "minLength": 1 }
    },
    "risk_level": { "type": "string", "enum": ["low", "medium", "high"] }
  }
}
